{
  "$schema": "../schemas/remediation-action-catalog.schema.json",
  "schema_version": "1.0.0",
  "policy_version": "1.0.0",
  "contract_status": "planning-only",
  "operational": false,
  "execution_available": false,
  "risk_classes": [
    {"id": "LOW", "description": "Read-only investigation or decision work with no host mutation."},
    {"id": "MODERATE", "description": "Bounded host change with limited scope but meaningful compatibility or availability risk."},
    {"id": "HIGH", "description": "Change can disrupt service, state, connectivity, recovery, or a security boundary."},
    {"id": "CRITICAL", "description": "Change can cause major state loss, loss of management access, or recovery requiring external intervention."}
  ],
  "scope_classes": [
    {"id": "HOST_TOOLING", "description": "Bootstrap and repository-management tooling on one host."},
    {"id": "HOST_RUNTIME", "description": "Host-level language or container runtime capability."},
    {"id": "SERVICE", "description": "Service lifecycle or service-manager state."},
    {"id": "NETWORK", "description": "Connectivity, routing, naming, or network control."},
    {"id": "FILESYSTEM", "description": "Filesystem or mount configuration and capability."},
    {"id": "STORAGE", "description": "Block storage, capacity, layout, or retention infrastructure."},
    {"id": "APPLICATION", "description": "Application-owned version, data, or migration behavior."},
    {"id": "CONFIGURATION", "description": "Non-secret configuration state."},
    {"id": "SECRET_REFERENCE", "description": "Reference to externally provided secret material; never the value."},
    {"id": "BACKUP", "description": "Backup readiness, recovery source, or protected state."},
    {"id": "SECURITY_BOUNDARY", "description": "Privilege, authorization, or control-plane boundary."}
  ],
  "approval_classes": [
    {"id": "NO_APPROVAL_NEEDED", "description": "Only non-mutating work within an already approved observation boundary."},
    {"id": "OPERATOR_APPROVAL", "description": "Explicit approval by the responsible operator bound to one plan fingerprint."},
    {"id": "ELEVATED_OPERATOR_APPROVAL", "description": "Explicit approval acknowledging privileged or high-impact host scope."},
    {"id": "MANUAL_EXTERNAL_APPROVAL", "description": "Approval by an application, security, storage, or other external authority."},
    {"id": "PROHIBITED_AUTOMATICALLY", "description": "The action may never be selected by an automatic execution policy."}
  ],
  "approval_states": [
    {"id": "NOT_REQUESTED", "description": "No approval request exists."},
    {"id": "REQUIRED", "description": "Explicit approval is required and has not been granted."},
    {"id": "APPROVED", "description": "A model approval record grants the exact plan under its constraints."},
    {"id": "DENIED", "description": "Approval was explicitly refused."},
    {"id": "EXPIRED", "description": "Approval validity ended."},
    {"id": "STALE", "description": "Plan, policy, resolved state, drift, or action identity changed."},
    {"id": "NOT_APPLICABLE", "description": "No approval is required for the item."}
  ],
  "precondition_states": [
    {"id": "SATISFIED", "description": "Available evidence proves the prerequisite."},
    {"id": "UNVERIFIED", "description": "The prerequisite must be checked before any future execution."},
    {"id": "UNSATISFIED", "description": "Available evidence proves execution must not proceed."},
    {"id": "NOT_APPLICABLE", "description": "The prerequisite does not apply to this proposal."}
  ],
  "rollback_classes": [
    {"id": "NOT_REQUIRED", "description": "No persistent state reversal is expected, though validation remains required."},
    {"id": "DEFINED_REQUIRED", "description": "A reviewed, specific reversal or version restore procedure must exist."},
    {"id": "BACKUP_REQUIRED", "description": "A verified recovery source is mandatory before the change."},
    {"id": "MANUAL_RECOVERY_REQUIRED", "description": "Recovery requires a documented human-operated procedure."},
    {"id": "NO_SAFE_AUTOMATIC_ROLLBACK", "description": "No automatic rollback is considered safe; execution stays specially constrained."}
  ],
  "failure_classes": [
    {"id": "STOP", "description": "Stop further actions and preserve evidence."},
    {"id": "ROLLBACK_REQUIRED", "description": "Stop and invoke a separately implemented reviewed rollback path."},
    {"id": "MANUAL_RECOVERY_REQUIRED", "description": "Stop and transfer control to the documented human recovery process."},
    {"id": "REASSESS_REQUIRED", "description": "Stop and generate fresh observation, drift, and planning state."}
  ],
  "action_classes": [
    {
      "id": "PACKAGE_OR_RUNTIME_PROVISION", "affected_domain": "HOST_RUNTIME", "mutation_class": "HOST_MUTATION",
      "description": "Provision or change an approved host tool or runtime through a future allowlisted implementation.",
      "default_risk": "MODERATE", "scopes": ["HOST_RUNTIME", "HOST_TOOLING"], "required_approval_classes": ["OPERATOR_APPROVAL"],
      "preconditions": [
        {"id": "supported-host-policy", "description": "The target host policy is approved and still satisfied.", "initial_state": "UNVERIFIED"},
        {"id": "package-source-trust", "description": "The future package or runtime source and version are reviewed.", "initial_state": "UNVERIFIED"},
        {"id": "rollback-capability", "description": "A defined version rollback or restore path exists.", "initial_state": "UNVERIFIED"}
      ],
      "validation_expectations": [
        {"id": "capability-observed", "description": "Bounded host inspection observes the required capability.", "initial_state": "UNVERIFIED"},
        {"id": "host-drift-rerun", "description": "A fresh drift report marks the source requirement SATISFIED.", "initial_state": "UNVERIFIED"}
      ],
      "rollback_class": "DEFINED_REQUIRED", "rollback_expectation": "Retain a reviewed version restore or host recovery procedure before execution.",
      "failure_behavior": "ROLLBACK_REQUIRED", "phase4g_may_plan": true, "future_automatic_execution": "REQUIRES_SEPARATE_FUTURE_POLICY"
    },
    {
      "id": "SERVICE_STATE_CHANGE", "affected_domain": "SERVICE", "mutation_class": "HOST_MUTATION",
      "description": "Change start, stop, restart, enablement, or service-manager state through a future dedicated implementation.",
      "default_risk": "HIGH", "scopes": ["SERVICE"], "required_approval_classes": ["OPERATOR_APPROVAL"],
      "preconditions": [
        {"id": "service-policy-approved", "description": "The service manager and intended state are approved.", "initial_state": "UNVERIFIED"},
        {"id": "maintenance-window", "description": "Any required service interruption window is approved.", "initial_state": "UNVERIFIED"}
      ],
      "validation_expectations": [
        {"id": "service-state-observed", "description": "A bounded state check observes the required service state.", "initial_state": "UNVERIFIED"},
        {"id": "host-drift-rerun", "description": "A fresh drift report marks the source requirement SATISFIED.", "initial_state": "UNVERIFIED"}
      ],
      "rollback_class": "NOT_REQUIRED", "rollback_expectation": "Persistent rollback is not assumed; stop and reassess if service validation fails.",
      "failure_behavior": "REASSESS_REQUIRED", "phase4g_may_plan": true, "future_automatic_execution": "REQUIRES_SEPARATE_FUTURE_POLICY"
    },
    {
      "id": "CONFIGURATION_CHANGE", "affected_domain": "CONFIGURATION", "mutation_class": "HOST_MUTATION",
      "description": "Change reviewed non-secret host configuration without embedding executable instructions.",
      "default_risk": "HIGH", "scopes": ["CONFIGURATION"], "required_approval_classes": ["ELEVATED_OPERATOR_APPROVAL"],
      "preconditions": [
        {"id": "configuration-source-available", "description": "Approved configuration is available without resolving secret values into the plan.", "initial_state": "UNVERIFIED"},
        {"id": "backup.pre-update-verified", "description": "The prior configuration or an equivalent recovery source is verified.", "initial_state": "UNVERIFIED"},
        {"id": "rollback-capability", "description": "A reviewed configuration restore procedure exists.", "initial_state": "UNVERIFIED"}
      ],
      "validation_expectations": [
        {"id": "configuration-capability-observed", "description": "Safe observation proves the intended capability without disclosing configuration values.", "initial_state": "UNVERIFIED"},
        {"id": "host-drift-rerun", "description": "A fresh drift report marks the source requirement SATISFIED.", "initial_state": "UNVERIFIED"}
      ],
      "rollback_class": "BACKUP_REQUIRED", "rollback_expectation": "Verify and retain the prior configuration before any future execution.",
      "failure_behavior": "ROLLBACK_REQUIRED", "phase4g_may_plan": true, "future_automatic_execution": "REQUIRES_SEPARATE_FUTURE_POLICY"
    },
    {
      "id": "FILESYSTEM_OR_MOUNT_CHANGE", "affected_domain": "FILESYSTEM", "mutation_class": "HOST_MUTATION",
      "description": "Change filesystem or mount configuration; formatting and destructive layout changes are outside this class.",
      "default_risk": "HIGH", "scopes": ["FILESYSTEM", "STORAGE"], "required_approval_classes": ["ELEVATED_OPERATOR_APPROVAL"],
      "preconditions": [
        {"id": "backup.pre-update-verified", "description": "Affected authoritative state has a verified recovery source.", "initial_state": "UNVERIFIED"},
        {"id": "mount-recovery-path", "description": "A manual mount and recovery path is documented.", "initial_state": "UNVERIFIED"}
      ],
      "validation_expectations": [
        {"id": "filesystem-capability-observed", "description": "Sanitized inspection observes the required filesystem or mount capability.", "initial_state": "UNVERIFIED"},